ID,Sentence
a1,Due to the relevance of the COVID-19 global pandemic
a2,we are releasing our dataset of tweets acquired from the Twitter Stream related to COVID-19 chatter
a3,The first 9 weeks of data (from January 1st 2020 to March 11th 2020) contain very low tweet counts as we filtered other data we were collecting for other research purposes
a4,however
a5,one can see the dramatic increase as the awareness for the virus spread
a6,Dedicated data gathering started from March 11th yielding over 4 million tweets a day
